{
  "document_type": "administratif",
  "content": "Semestres UE ECTS Modules Cours TD TP-­‐ Projet Non encadré Total Coef Code Anglais 1 30 30 2 C5-­‐LAN Entreprise et Management 1 30 30 2 S5-­‐SEM Algorithmique numérique 1 8 2 8 18 2 S5-­‐IAN Structures mathématiques 22 22 44 3 S5-­‐MAH Analyse thermodynamique en géosciences 14 14 28 2 S5-­‐GAT Développement Durable et Responsabilité Sociétale 10 10 1 S5-­‐DDR Total UE Socle d’ingénieur 1 54 98 8 0 160 12 Introduction à la géologie 26 4 30 2 S5-­‐GLI Cartographie géologique 30 30 3 S5-­‐GLC Géotechnique-­‐géophysique-­‐hydrogéologie 22 8 30 3 S5-­‐GGH Processus chimiques dans l'environnement 1 20 10 30 2 S5-­‐GCE Total UE Bases en géosciences 1 68 10 42 0 120 10 Mécanique des Milieux Continus 1 22 30 52 4 S5-­‐AMC Résistance Des Matériaux 1 -­‐ Elasticité 15 15 30 2 S5-­‐ARM Mécanique des fluides 15 15 30 2 S5-­‐AMF Total UE Mécanique 1 52 60 0 0 112 8 30 Total semestre 5 174 168 50 0 392 30 Semestres UE ECTS Modules Cours TD TP-­‐ Projet Non encadré Total Coef Code Engagement étudiant 30 30 2 C6-­‐DMO Total UE Engagement étudiant 0 0 0 30 30 2 Anglais 2 30 30 2 C6-­‐LAN Entreprise et Management 2 30 30 2 S6-­‐SEM Informatique 1 12 18 30 2 S6-­‐IFO Algorithmique numérique 2 20 22 42 3 S6-­‐IAN Analyse de Fourier et distributions 18 18 36 3 S6-­‐MAF Probabilités 12 12 24 2 S6-­‐MPR Total UE Socle d’ingénieur 2 62 90 40 0 192 14 Sédimentologie 14 10 6 30 3 S6-­‐GLS Stage de terrain de géologie ST3 30 30 3 S6-­‐GLT Processus chimiques dans l'environnement 2 14 10 6 30 3 S6-­‐GCE Total UE Bases en géosciences 2 28 20 42 0 90 9 Mécanique des Milieux Continus 2 8 14 22 1,5 S6-­‐AMC Résistance Des Matériaux 2 -­‐ Milieux curvilignes 15 15 30 2 S6-­‐ARM Ondes mécaniques 1 10 10 20 1,5 S6-­‐AOM Total UE Mécanique 2 33 39 0 0 72 5 30 Total semestre 6 123 149 82 30 384 30 Semestres UE ECTS Modules Cours TD TP-­‐ Projet Non encadré Total Coef Code Ondes mécaniques 2 12 12 24 2 S7-­‐AOM Mécanique des sols 1 24 16 40 3 S7-­‐AMS Tectonique 20 20 2 S7-­‐GLT Télédétection 4 8 12 1 S7-­‐GTT Système d'information géographique 1 3 12 15 1 S7-­‐GSI Total UE Géomécanique 1 43 28 40 0 111 9 Anglais 3 30 30 2 C7-­‐LAN Informatique 2 20 20 40 3 S7-­‐IFO Mécanique 1 8 S5 Spécialité Sciences de la Terre -­‐ Maquette 2022-­‐2023 Socle d’ingénieur 1 12 Bases en géosciences 1 10 Engagement étudiant 2 Socle d’ingénieur 2 14 Bases en géosciences 2 9 Mécanique 2 5 Géomécanique 1 9 S6 Management et Projet 1 20 10 30 2 S7-­‐SMP Stage « découverte de l’entreprise » Année 3 0 1 S7-­‐DDE Total UE Techniques de l’ingénieur 1 40 40 20 0 100 8 Méthodes sismiques 60 60 4 S7-­‐GMS Méthodes électriques et électromagnétiques 33 6 6 45 3 S7-­‐GEM Méthode « potentiel » : fondements théoriques 15 15 1,5 S7-­‐GMP Géostatistique 15 6 21 1,5 S7-­‐GST Traitement des données 19 20 39 3 S7-­‐GTD Total UE Géophysique 1 142 6 26 6 180 13 30 Total semestre 7 225 74 86 6 391 30 Semestres UE ECTS Modules Cours TD TP-­‐ Projet Non encadré Total Coef Code Plasticité 10 10 20 2 S8-­‐APL Mécanique des sols 2 14 14 2 S8-­‐AMS Mécanique des roches 30 30 2 S8-­‐AMR Modélisation en hydrosciences/géosciences 20 10 30 2 S8-­‐GMO Béton 30 30 2 S8-­‐ABE Hydraulique 14 12 26 2 S8-­‐AHY Total UE Géomécanique 2 84 22 34 10 150 12 Anglais 4 30 30 2 C8-­‐LAN Management et Projet 2 10 20 30 2 S8-­‐SMP Projet de cartographie et ressources naturelles 1 21 8 30 2 S8-­‐GLC Stage de terrain de géologie ST4 30 30 3 S8-­‐GLT Total UE Techniques de l’ingénieur 2 11 50 51 8 120 9 Mesures et traitements du signal 17 2 11 30 2 S8-­‐GMT Intégration de données en géosciences 20 10 30 2 S8-­‐GID Méthode « potentiel » : application à la gravimètrie et au m 24 6 30 2 S8-­‐GMP Stage de terrain de prospection géophysique 30 30 3 S8-­‐GGT Total UE Géophysique 2 41 2 67 10 120 9 30 Total semestre 8 136 74 152 28 390 30 Semestres UE ECTS Modules Cours TD TP-­‐ Projet Non encadré Total Coef Code Anglais 5 30 30 2 C9-­‐LAN Economie et Entreprise 12 12 24 1,5 S9-­‐SEE Séminaire entreprendre et piloter 30 30 1,5 S9-­‐SEP Droit de l'environnement 15 15 1 S9-­‐GIC Ingénieur et société 15 15 1 S9-­‐SES Introduction à Aménagement, Risques, géo-­‐Energies 9 6 15 1 S9-­‐GIO Total UE Pratiques d’ingénieur 42 42 39 6 129 8 Hydrogéologie quantitative 30 7,5 7,5 45 3 S9-­‐GHQ Hydrologie de surface 15 10 25 2 S9-­‐GHS Système d'information géographique 2 12 12 1 S9-­‐GSI Problèmes inverses 15 15 30 2 S9-­‐GPI Solveurs multiphysiques 22,5 22,5 45 3 S9-­‐GSM Total UE Géosciences et eau 60 10 0 30 157 11 Fondations 39 6 45 3 S9-­‐AFO Ouvrages souterrains 25 25 1,5 S9-­‐GOS Infrastructures 15 15 1,5 S9-­‐GIF Building Information Modelling 10 10 1 S9-­‐GBI Bureau d'étude en aménagement 3 6 21 30 3 S9-­‐GBA Stage de terrain en géotechnique 12 12 1 S9-­‐GAT Géophysique 1 13 Techniques de l’ingénieur 1 8 Géomécanique 2 12 Techniques de l’ingénieur 2 9 Géophysique 2 9 S7 S8 S9 Pratiques d’ingénieur 8 Géosciences et eau 11 Option Aménagement 11 Total UE Option Aménagement 82 0 34 21 137 11 Aléas naturels 15 20 35 3 S9-­‐GLA Gestion des riques naturels 5 10 15 1 S9-­‐GRN Risques environnementaux, études d'impact 25 25 2 S9-­‐GRE Sites et Sols pollués 15 15 1 S9-­‐GSP Bureau d'étude en risques 3 6 21 30 3 S9-­‐GBR Stage de terrain en risque environnemental 12 12 1 S9-­‐GRT Total UE Option Risques 63 30 18 21 132 11 Propriétés réservoir 10 10 20 1,5 S9-­‐GRP Monitoring de réservoir 20 20 1,5 S9-­‐GRD Géothermies et énergies nouvelles 20 10 30 3 S9-­‐GEN Stockage souterrain 10 10 20 1 S9-­‐GSS Bureau d'étude en géo-­‐énergies 3 6 21 30 3 S9-­‐GBE Stage de terrain en géo-­‐énergies 12 12 1 S9-­‐GET Total UE Option géo-­‐Energies 63 30 18 21 132 11 30 Total semestre 9 min 165 52 57 57 418 30 30 Total semestre 9 max 184 82 73 57 423 30 Semestres UE ECTS Modules Cours TD TP-­‐ Projet Non encadré Total Coef Code 5 Stage technique Année 4 5 S0-­‐DST 25 Stage de fin d'études Année 5 25 S0-­‐DFE 30 Total semestre 10 30 Total cursus min 823 517 427 121 1975 180 Total cursus max 842 547 443 121 1980 180 11 S10 Stages Option Risques 11 Option géo-­‐Energies",
  "metadata": {
    "title": "Maquette ST 2022",
    "secteur": "",
    "date": "2022-04-11T14:30:11",
    "auteurs": []
  },
  "source": {
    "chemin_local": "/home/adrien/Documents/poly4emeAnee/Projet-Stage/Projet-Chatbot/Document_handler/scraping/data_sites/polytech_sorbonne/pdf_scrapes/Maquette_ST_2022-23_officielle_modif_0.pdf",
    "site": "scraped_sorbonne",
    "url": "https://www.polytech.sorbonne-universite.fr/index.php/formations/sciences-de-la-terre"
  },
  "tags": [
    "géosciences",
    "mécanique",
    "algorithmique",
    "développement durable",
    "ingénierie",
    "hydrologie",
    "géophysique",
    "cartographie",
    "sédimentologie",
    "matériaux",
    "environnement",
    "risques naturels",
    "énergie",
    "projet",
    "stage",
    "enseignement",
    "analyse thermodynamique",
    "structures mathématiques",
    "télédétection",
    "système d'information géographique"
  ],
  "type_specific": {
    "administratif": {
      "service": "",
      "contact": {
        "email": "",
        "telephone": ""
      }
    }
  }
}