{
  "document_type": "administratif",
  "content": "Vandœuvre les Nancy, le 10 octobre 2024 Communiqué de presse Modalités des concours Geipi Polytech 2025 Les directeurs des écoles d’ingénieurs publiques du groupement Geipi Polytech se sont réunis en Assemblée Générale fin septembre. Ils ont établi un bilan des concours 2024 et ont voté les modalités des concours 2025. BILAN DES CONCOURS 2024 Les directeurs ont exprimé leur satisfaction face au bilan positif des concours. Concernant le concours Bac général : 24 339 bacheliers se sont inscrits en 2024, soit une légère augmentation par rapport à 2023. Cette année encore, la qualité des dossiers est au rendez-vous : plus de 80% des candidats intégrés ont obtenu une mention B ou TB au baccalauréat. Concernant le concours Bac technologique, le nombre de candidats a augmenté de 17% passant de 797 inscrits à 933 en 2024. Plus de 85% des candidats intégrés ont obtenu une mention B ou TB au bac. MODALITÉS DES CONCOURS 2025 Le concours Geipi Polytech 2025 proposera 3 987 places aux élèves de Terminale générale et titulaires du baccalauréat général 2024, ainsi que 212 places aux élèves de Terminale technologique STI2D et STL et titulaires du baccalauréat STI2D ou STL 2024. Les modalités des concours 2025 restent les mêmes qu’en 2024 : Déroulement du concours Bac général Etude de dossier + épreuve écrite pour l’ensemble des candidats. L’épreuve écrite, d’une durée de 3h, se déroulera le mardi 29 avril 2025 dans plus de 200 centres d’examen en France et à l’étranger : un sujet de mathématiques + deux sujets à choisir parmi mathématiques, physique-chimie, SVT, NSI et SI. Déroulement du concours Bac technologique Etude de dossier pour l’ensemble des candidats, puis les meilleurs dossiers seront convoqués à un entretien de motivation qui se déroulera fin avril-début mai. Modalités complètes des concours sur notre site www.geipi-polytech.org NOUVEAUTÉS 2025 A partir de cette année, les écoles ENSIM Le Mans et Sup Galilée Paris proposent des places au concours Bac technologique. Pour le concours Bac général : l’ESIROI La Réunion offre des places dans un parcours BIO, Sup Galilée Paris offre des places dans un parcours Numérique/informatique, Polytech Annecy-Chambéry offre des places dans un cycle préparatoire localisé en Polynésie française et Polytech Nice offre des places dans un cycle préparatoire localisé en Nouvelle-Calédonie. 1/2 Contact presse Caroline SCHWARTZ, Responsable administrative du concours : Portable : 06 07 46 51 40 ou 03 72 74 68 39 Courriel : communication@geipi-polytech.org NOMBRE DE PLACES OFFERTES EN 2025 (NC = Non concerné) Ecoles Bac Général Bac STI2D Bac STL Centrale Lyon ENISE 120 NC NC EEIGM Nancy 82 NC NC ENIB Brest 120 NC NC ENIM Metz 148 12 NC ENIT Tarbes 170 12 NC ENSGSI Nancy 50 NC NC ENSIBS Lorient Vannes 80 30 NC ENSIM Le Mans 35 5 NC ESGT Le Mans 35 5 NC ESIR Rennes 65 NC NC ESIROI La Réunion 24 + 8 BIO 4 4 Grenoble INP Esisar Valence 60 NC NC IMT Nord Europe 160 NC NC ISAT Nevers 90 NC NC ISEL Le Havre 35 NC NC ISTY UVSQ Paris-Saclay 35 NC NC L’Institut Agro Dijon 27 + 27 BIO NC NC Sup Galilée Paris 68 16 NC Télécom Saint-Étienne 88 NC NC Polytech Angers 94 + 32 BIO 8 NC Polytech Annecy-Chambéry 140 NC NC Polytech Clermont 120 + 40 BIO NC NC Polytech Dijon 120 NC NC Polytech Grenoble 135 6 6 Polytech Lille 145 + 25 BIO 6 NC Polytech Lyon 132 24 NC Polytech Marseille 200 16 2 Polytech Montpellier 180 + 25 BIO NC NC Polytech Nancy 144 NC NC Polytech Nantes 165 32 NC Polytech Nice Sophia 136 NC NC Polytech Orléans 150 24 NC Polytech Paris-Saclay 150 NC NC Polytech Sorbonne 145 + 32 BIO NC NC Polytech Tours 150 NC NC TOTAL 3 987 212 2/2",
  "metadata": {
    "title": "CP concours Geipi Polytech 2025",
    "secteur": "",
    "date": "2024-10-10T08:48:14",
    "auteurs": []
  },
  "source": {
    "chemin_local": "/home/adrien/Documents/poly4emeAnee/Projet-Stage/Projet-Chatbot/Document_handler/scraping/data_sites/geipi_polytech/pdf_scrapes/CP-concours-Geipi-Polytech-2025.pdf",
    "site": "scraped_geipi",
    "url": "https://www.geipi-polytech.org/presse/"
  },
  "tags": [
    "Geipi Polytech",
    "concours",
    "2025",
    "baccalauréat",
    "Bac général",
    "Bac technologique",
    "modalités",
    "inscriptions",
    "épreuves",
    "mathématiques",
    "physique-chimie",
    "SVT",
    "NSI",
    "SI",
    "entretien de motivation",
    "places offertes",
    "écoles d'ingénieurs",
    "bilan 2024",
    "nouveautés 2025",
    "candidats",
    "dossier",
    "contact presse"
  ],
  "type_specific": {
    "administratif": {
      "service": "Concours Geipi Polytech",
      "contact": {
        "email": "communication@geipi-polytech.org",
        "telephone": "06 07 46 51 40"
      }
    }
  }
}