{
  "document_type": "administratif",
  "content": "Semestre UE ECTS Modules Coefficient Code Outils mathématiques pour les matériaux 3 M5-M01 Compétences numériques (PIX) 2 M5-IPX Total UE Outils mathématiques et numériques 5 Bases de chimie pour les matériaux✿ 6 M5-CBC Synthèse Organique 3 M5-CSO Verres✿ 1 M5-CVE Total UE Chimie des Matériaux 10 Interaction rayonnement matière 1 M5-CIR Thermodynamique et Analyse Thermique 5 M5-CTH Cristallographie et diffraction 2 M5-CCD Total UE Physique des Matériaux 8 Entreprise et Management 1 2 M5-SEM Anglais 1 2 C5-LAN Séminaires Entreprises et Métiers✿ 0 M5-DEM Projet matériaux✿ 2 M5-DPM Développement durable et responsabilité Sociétale✿✿✿ 1 C5-DDR Total UE Compétences transversales de l'ingénieur 7 Semestre UE ECTS Modules Coefficient Code Techniques spectroscopiques 2.5 M6-CTS Mécanique des milieux continus 1.5 M6-AMC Conception et modélisation par éléments finis✿ 2 M6-AMO Total UE Conception, mécanique et analyse 6 Synthèse de matériaux inorganiques en solution✿ 3 M6-CSM Synthèse organique et macromoléculaire 3 M6-COM Total UE Synthèse des Matériaux 6 Transferts thermiques 2 M6-ATT Procédés Céramiques 2 M6-CPC Transformations de phases 2 M6-CTP Rhéologie 2 M6-ARH Total UE Procédés 8 Anglais 2 2 C6-LAN Projet matériaux✿ 2 M6-DPM Analyse de données et Plan d’expériences 2 M6-CAD Entreprise et Management 2 2 M6-SEM Total UE Compétences transversales de l'ingénieur 8 Engagement étudiant 2 C6-DEE Total UE Engagement étudiant 2 Semestre UE ECTS Modules Coefficient Code Techniques spectroscopiques avancées 3 M7-CTS Microscopies et diffraction 1 M7-CMD Total UE Caractérisation des matériaux 4 Solide réel✿ 2 M7-CSR Physique du solide✿ 2 M7-CPS Milieux Dispersés✿ 2 M7-COL Procédés Céramiques 2 M7-CPC Procédés métallurgiques 3 M7-CPM Total UE Métaux et Matériaux inorganiques 11 Synthèse des Polymères 3 M7-CSP Physicochimie des polymères 3 M7-CPP Polymères à l'état solide et propriétés mécaniques 2 M7-CMP Total UE Polymères 8 Anglais 3 2 C7-LAN Stage de découverte de l’entreprise 1 C7-DDE Management et Projet 1 2 M7-SMP Projet industriel✿ 2 M7-DPR Séminaires Entreprises et Métiers✿ 0 M7-DEM Total UE Compétences transversales de l'ingénieur 7 MTX3 MTX4 S6 Compétences transversales de l'ingénieur 8 Procédés 6 Synthèse des Matériaux 6 Conception, mécanique et analyse 8 Compétences transversales de l'ingénieur 7 8 Engagement étudiant 2 S7 Caractérisation des matériaux 4 Métaux et Matériaux inorganiques 11 Polymères 7 Polytech Sorbonne Spécialité Matériaux (MTX) Maquette 2024-2025 Développement Durable et Responsabilité Sociétale (DDRS) ✿ Quelques notions de DDRS abordées dans le module ✿✿ Environ 50% du module concerne des notions relatives au DDRS ✿✿✿ Le module est dédié à des notions qui concernent le DDRS S5 Outils mathématiques et numériques 5 Chimie des Matériaux 10 Physique des Matériaux 8 Compétences transversales de l'ingénieur Semestre UE ECTS Modules Coefficient Code Polymères industriels✿✿ 2 M8-CPI Biominéraux et biomatériaux 2 M8-CBB Propriétés physiques (Électriques et magnétiques)✿ 3 M8-CPH Propriétés mécaniques des métaux 3 M8-AMM Total UE Matériaux et propriétés 10 Films, nanomatériaux et matériaux poreux 4 M8-CFI Électrochimie et corrosion 3 M8-CEC Surfaces et interfaces 3 M8-CSI Total UE Surfaces 10 Projet industriel✿ 6 M8-DPR Total UE Projet industriel 6 Anglais 4 2 C8-LAN Management et Projet 2 2 M8-SMP Total UE Compétences transversales de l'ingénieur 4 Semestre UE ECTS Modules Coefficient Code UE Master 6 Code Master UE Master 6 Code Master Total UE Recherche et Matériaux 12 Fabrication additive 1.5 M9-CFA Soudage 1 M9-CSO Mise en forme de matériaux polymères✿ 2 M9-CMF Modélisation moléculaire✿ 1.5 M9-CMO Total UE Mise en œuvre des matériaux 6 Certification et qualité 1 M9-CER Nanomatériaux et législation 1 M9-CNA Ressources et Recyclage✿✿✿ 2 M9-CRE Ingénierie biomédicale et biomatériaux 2 M9-CBI Total UE Matériaux et entreprise 6 Anglais 5 2 C9-LAN Séminaires Entreprises et Métiers✿ 0 M9-DEM Management de l'innovation✿ 2.5 M9-SIM Séminaire entreprendre et piloter 1.5 C9-SEP Total UE Compétences transversales de l'ingénieur 6 Semestre UE ECTS Modules Coefficient Code UE Master 6 Code Master Total UE Recherche et Matériaux 6 Fabrication additive 1.5 M9-CFA Soudage 1 M9-CSO Mise en forme de matériaux polymères✿ 2 M9-CMF Modélisation moléculaire✿ 1.5 M9-CMO Total UE Mise en œuvre des matériaux 6 Certification et qualité 1 M9-CER Nanomatériaux et législation✿✿✿ 1 M9-CNA Ressources et Recyclage✿✿✿ 2 M9-CRE Ingénierie biomédicale et biomatériaux 2 M9-CBI Total UE Matériaux et entreprise 6 Anglais 5 2 C9-LAN Séminaires Entreprises et Métiers✿ 0 M9-DEM Management de l'innovation✿ 2.5 M9-SIM Séminaire entreprendre et piloter✿✿✿ 1.5 C9-SEP Total UE Compétences transversales de l'ingénieur 6 Période entreprise 6 M9-DPE Total UE Entreprise 6 Semestre UE ECTS Modules Coefficient Code Stage Technique✿ 5 M0-DST Total UE Stage MTX4 5 Stage Ingénieur✿ 25 M0-DFE Total UE Stage MTX5 25 Semestre UE ECTS Modules Coefficient Code Stage Technique✿ 5 M0-DST Total UE Stage MTX4 5 Période entreprise✿ 25 M0-DPE Total UE Entreprise 25 MTX5 S10 Stage MTX4 5 Stage MTX5 25 S10 PRO Stage MTX4 5 Entreprise 25 6 Compétences transversales de l'ingénieur 6 Entreprise 6 6 Compétences transversales de l'ingénieur 6 S9 PRO Recherche et Matériaux 6 Mise en œuvre des matériaux 6 Matériaux et entreprise 6 Compétences transversales de l'ingénieur 4 S9 Recherche et Matériaux 12 Mise en œuvre des matériaux 6 Matériaux et entreprise S8 Matériaux et propriétés 10 Surfaces 10 Projet industriel",
  "metadata": {
    "title": "Maquette MTX 2024 2025 avril2024",
    "secteur": "",
    "date": "2024-04-05T17:39:44",
    "auteurs": []
  },
  "source": {
    "chemin_local": "/home/adrien/Documents/poly4emeAnee/Projet-Stage/Projet-Chatbot/Document_handler/scraping/data_sites/polytech_sorbonne/pdf_scrapes/Maquette_MTX_2024_2025_avril2024_web.pdf",
    "site": "scraped_sorbonne",
    "url": "https://www.polytech.sorbonne-universite.fr/index.php/formations/materiaux"
  },
  "tags": [
    "Matériaux",
    "Chimie",
    "Physique",
    "Polymères",
    "Ingénierie",
    "Développement durable",
    "Responsabilité sociétale",
    "Caractérisation",
    "Synthèse",
    "Procédés",
    "Mécanique",
    "Mathématiques",
    "Numérique",
    "Spectroscopie",
    "Cristallographie",
    "Thermodynamique",
    "Rhéologie",
    "Microscopie",
    "Nanomatériaux",
    "Biomatériaux",
    "Gestion de projet",
    "Compétences transversales",
    "Stage",
    "Engagement étudiant"
  ],
  "type_specific": {
    "administratif": {
      "service": "Maquette MTX 2024-2025",
      "contact": {
        "email": "",
        "telephone": ""
      }
    }
  }
}