{
  "document_type": "administratif",
  "content": "CHARTE DÉVELOPPEMENT DURABLE RESPONSABILITÉ SOCIÉTALE Édition 2020 ANGERS ANNECY-CHAMBERY CLERMONT-FERRAND GRENOBLE LILLE LYON MARSEILLE MONTPELLIER NANCY NANTES NICE SOPHIA ORLÉANS SORBONNE PARIS-SACLAY TOURS Le réseau français des écoles d’ingénieurs polytechniques des universités • www.polytech-reseau.org 2 La charte développement durable et responsabilité sociétale (DDRS) du réseau Polytech marque son engagement volontaire, au-delà des exigences légales, de déploiement d’une dynamique DDRS au sein de toutes les écoles du réseau impliquant les élèves ingénieur(e)s, les enseignant(e)s et enseignant(e)s-cher- cheur(se)s et les personnels administratifs et techniques. Elle s’inscrit totalement dans les préconisations de la Commission du Titre d’Ingénieur 1. Le réseau Polytech est conscient des enjeux majeurs de sensibili- sation et de formation des futur(e)s ingénieur(e)s au DDRS en lien avec les défis de transitions sociétales. Au travers de ses valeurs : respect et ouverture, exigence et créativité, responsabilité et transparence, anticipation et esprit d’équipe, le réseau a comme objectif de former des ingénieur(e)s responsables et citoyen(ne)s, capables de construire leur mode de pensée et d’action en phase avec les enjeux écologiques. Les engagements DDRS du réseau Polytech sont en cohé- rence avec la stratégie DDRS nationale qui est basée sur l’ar- ticle 55 de la loi n°2009-967 du 3 août 2009 de programmation relative à la mise en œuvre du Grenelle de l’environnement, dite « Grenelle 1 », imposant à tous les établissements d’enseignement supérieur la mise en place d’une démarche de développement durable au travers d’un Plan Vert. Les écoles participeront aussi à la dynamique DDRS de leur université d’appartenance. À cette fin, le réseau Polytech s’engage à intégrer les principes du plan vert dans sa propre stratégie, la gouvernance, le manage- ment, les relations avec l’ensemble des parties prenantes (tutelles, personnel, étudiant(e)s, partenaires industriels ou institutionnels) et le fonctionnement opérationnel de ses écoles. Les objectifs seront progressivement mis en œuvre en fonction de la situation relative à chaque école. PRÉAMBULE 1 https://api.cti-commission.fr/uploads/documents/backend/document_25_fr_references-et-orientations-livre-1_07-02-2020.pdf 3 1 / Enseignement et formation Sensibiliser la totalité des élèves ingénieur(e)s aux enjeux sociétaux dès le début de la for- mation. Un test de mesure et d’amélioration des connaissances sur la compréhension des grands défis du monde pour un futur soutenable s’appuyant sur les ODD de l’ONU 2 a été élaboré et sera déployé à l’échelle du réseau (PolyTest). Former la totalité des élèves aux enjeux de transition écologique via le déploiement d’un module de formation commun à l’ensemble du réseau et décliner également ces théma- tiques au sein des enseignements techniques et scientifiques quand c’est possible. Valoriser les compétences acquises en DDRS via le supplément au diplôme. 2 / Environnement Mettre en œuvre un plan ambitieux pour amé- liorer les performances des infrastructures. Chaque école fera son bilan carbone® en interne selon la périodicité réglementaire et établira un plan d’action pour diminuer son impact environnemental. Cet objectif passe par l’enga- gement de formation des personnels adminis- tratifs et techniques, des enseignant(e)s, et des enseignant(e)s-chercheur(se)s à des compé- tences liées au déploiement d’une politique de réduction de l’empreinte carbone. Devenir un terrain d’expérimentation qui per- mettra de mettre en place des projets interdis- ciplinaires dont l’objectif sera de collecter des données à l’échelle des écoles (bilan éner- gétique, consommation d’eau, gestion des déchets, etc.), de les analyser et de mener des études sur l’impact environnemental du réseau Polytech. Mettre en place une gestion responsable des activités du réseau déclinée dans les différentes procédures en s’appuyant sur des référentiels reconnus (achats responsables, etc.). Nos engagements 2 https://www.un.org/sustainabledevelopment/fr/objectifs-de-developpement-durable Les élèves et personnels de Polytech Paris-Saclay ont participé au World CleanUp day 2020, un événement mondial pour nettoyer la planète. 4 3 / Valorisation et recherche Ambitionner de participer à la résolution des questions liées aux enjeux d’innovation scienti- fique alliés aux enjeux économiques et sociaux de la transition écologique en particulier en valorisant l’activité des enseignants-cher- cheurs des écoles dans ce domaine. Soutenir spécifiquement des projets interdis- ciplinaires DDRS formation/recherche intra et inter écoles, ou plus largement dans un contexte national et/ou international, en lien avec le monde de la recherche académique ou privée sera proposé. 4 / Gouvernance Déployer une démarche DDRS dans les écoles, formalisée par une politique dédiée, s’appuyant sur le référentiel sectoriel DDRS / CPU-CGE. Mettre en place une gouvernance de la poli- tique DDRS permettant la protection et la valo- risation de l’environnement, le développement économique et le progrès social. La politique sera déclinée dans une logique d’amélioration continue. Chaque école identifiera un référent DDRS et lui assignera une lettre de mission, s’appuyant sur la présente charte, à la hauteur des défis sociétaux. Engager la concertation avec les parties pre- nantes afin de mieux connaître leurs attentes et propositions de manière à favoriser leur contri- bution au DDRS. Évoquer régulièrement l’engagement en DDRS en directoire et au conseil d’administration de la fondation partenariale Polytech concernant l’élaboration de la stratégie et des plans d’ac- tion et rendre compte de l’évolution des pra- tiques en toute transparence en s’appuyant sur le groupe de travail DDRS du réseau. Assurer l’auto-évaluation annuelle et réaliser les remontées des référentiels DDRS / CPU-CGE vers une des structures compétentes au choix des écoles (CGE, CPU, CIRSES) afin d’aug- menter la visibilité du réseau Polytech auprès des différentes instances engagées en matière de DDRS. 5 / Politique sociale et ancrage territorial Promouvoir la diversité, accepter et accom- pagner la différence pour l’ensemble des par- ties prenantes (genre, situation de handicap, artistes / sportif(ve)s de haut niveau, entrepre- neurs, etc.), en développant des plans spéci- fiques d’intégration pour les personnels et des programmes pédagogiques adaptés pour les élèves ingénieur(e)s. Établir un plan d’action relatif à l’amélioration des conditions de qualité de vie au travail pour une meilleure reconnaissance et valorisation de chacun. Valoriser au sein des écoles les engage- ments DDRS des élèves ingénieur(e)s, enseignant(e)s, enseignant(e)s-chercheur(se)s, personnels administratifs et techniques, diplô- mé(e)s et alumni et les accompagner. Élaborer des partenariats sur les enjeux DDRS à différentes échelles territoriales. L'équipe \"Les Raisinvoltes\" de Polytech Montpellier qui a remporté le prix \"Lutte contre le Gaspillage Alimentaire\" lors du concours Ecotrophelia France 2019. CHARTE DÉVELOPPEMENT DURABLE ET RESPONSABILITÉ SOCIÉTALE Charte validée le 19 novembre 2020 par le Conseil d’administration de la Fondation partenariale Polytech Signature des directeur.rice.s des écoles du réseau Polytech Directeur Polytech Tours Paris-Saclay Lille Sorbonne Nancy Le Mans Nantes Orléans Angers Tours Lyon Clermont-Ferrand Annecy- Chambery Grenoble Montpellier Marseille Nice Sophia Le Havre ANGERS - ANNECY-CHAMBÉRY - CLERMONT-FERRAND - GRENOBLE - LILLE - LYON - MARSEILLE MONTPELLIER - NANCY - NANTES - NICE SOPHIA - ORLÉANS - PARIS-SACLAY - SORBONNE - TOURS Écoles membres du réseau Écoles associées Polytech au 30/10/2020 : • Ensim de l’Université du Mans • ESGT du Cnam • ISEL de l’Université Le Havre-Normandie 15 ÉCOLES D’INGÉNIEURS UNIVERSITAIRES PUBLIQUES 17 500 ÉLÈVES INGÉNIEUR 3 ÉCOLES ASSOCIÉES + de 90 000 INGÉNIEURS EN ACTIVITÉ 160 LABORATOIRES DE RECHERCHE LE RÉSEAU POLYTECH EN 2020 3 800 DIPLÔMÉS PAR AN www.polytech-reseau.org",
  "metadata": {
    "title": "ReseauPolytech CharteDDRS Janv2021",
    "secteur": "",
    "date": "2021-07-20T10:12:03",
    "auteurs": []
  },
  "source": {
    "chemin_local": "/home/adrien/Documents/poly4emeAnee/Projet-Stage/Projet-Chatbot/Document_handler/scraping/data_sites/polytech_sorbonne/pdf_scrapes/ReseauPolytech_CharteDDRS_Janv2021.pdf",
    "site": "scraped_sorbonne",
    "url": "https://www.polytech.sorbonne-universite.fr/index.php/developpement-durable-et-responsabilite-societale"
  },
  "tags": [
    "développement durable",
    "responsabilité sociétale",
    "écoles d'ingénieurs",
    "réseau Polytech",
    "sensibilisation",
    "formation",
    "transition écologique",
    "empreinte carbone",
    "gouvernance",
    "politique sociale",
    "diversité",
    "partenariats",
    "objectifs de développement durable",
    "innovation",
    "bilan carbone",
    "impact environnemental",
    "engagement",
    "Plan Vert",
    "éducation",
    "société",
    "écologie"
  ],
  "type_specific": {
    "administratif": {
      "service": "",
      "contact": {
        "email": "",
        "telephone": ""
      }
    }
  }
}